{
  "pack_contract_version": "1.0.0",
  "pack_id": "openrouter.minimax-m2.7.normative-extraction.external-evidence.v1",
  "pack_version": "1.0.0",
  "canonicalization_version": "registry-json-v1",
  "candidate_path": {
    "dossier_id": "openrouter.minimax-m2.7.normative-extraction.v1",
    "provider_id": "openrouter",
    "openrouter_model_id": "minimax/minimax-m2.7",
    "upstream_provider_id": "minimax",
    "upstream_model_id": null,
    "model_registry_entry_id": "openrouter.minimax-m2.7.variable.v1",
    "route_record_id": "openrouter.minimax-m2.7.variable-route.v1",
    "execution_profile_candidate_id": "openrouter.minimax-m2.7.normative-extraction.candidate",
    "capability_id": "evidence.extraction.normative_claims"
  },
  "collected_at": "2026-07-14T12:00:00.000Z",
  "records": [
    {
      "evidence_id": "openrouter.external.model-identity.v1",
      "category": "exact_model_identifier",
      "claim": "OpenRouter publishes the exact model identifier minimax/minimax-m2.7 and attributes the model to MiniMax.",
      "source": {
        "title": "MiniMax M2.7 - API Pricing & Benchmarks",
        "publisher": "OpenRouter",
        "canonical_url": "https://openrouter.ai/minimax/minimax-m2.7/providers",
        "source_type": "official_openrouter_model_metadata",
        "retrieved_at": "2026-07-14T12:00:00.000Z",
        "published_or_effective_at": "2026-03-18T00:00:00.000Z"
      },
      "normalized_fact": "The official model page displays slug minimax/minimax-m2.7, publisher MiniMax, and release date 2026-03-18.",
      "state": "unverified",
      "reviewer_id": null,
      "reviewed_at": null,
      "re_review_at": "2026-08-13T12:00:00.000Z",
      "integrity_hash": "485b4e999a5a44b2a4b53d805086c36585323b2e12c5cb24a171496095db9f7b",
      "conflicts_with": [],
      "limitations": [
        "The OpenRouter slug does not prove an immutable upstream model revision or endpoint."
      ],
      "bindings": {
        "dossier_id": "openrouter.minimax-m2.7.normative-extraction.v1",
        "provider_id": "openrouter",
        "openrouter_model_id": "minimax/minimax-m2.7",
        "upstream_provider_id": "minimax",
        "upstream_model_id": null,
        "model_registry_entry_id": "openrouter.minimax-m2.7.variable.v1",
        "route_record_id": "openrouter.minimax-m2.7.variable-route.v1",
        "execution_profile_candidate_id": "openrouter.minimax-m2.7.normative-extraction.candidate",
        "capability_id": "evidence.extraction.normative_claims"
      },
      "attributes": {
        "exact_openrouter_model_id_proven": true,
        "exact_upstream_revision_proven": false
      }
    },
    {
      "evidence_id": "openrouter.external.routing.v1",
      "category": "exact_upstream_route",
      "claim": "OpenRouter routes a model across multiple providers by default; order can be supplied and provider fallback defaults to enabled.",
      "source": {
        "title": "Provider Routing",
        "publisher": "OpenRouter",
        "canonical_url": "https://openrouter.ai/docs/guides/routing/provider-selection",
        "source_type": "official_openrouter_documentation",
        "retrieved_at": "2026-07-14T12:00:00.000Z",
        "published_or_effective_at": null
      },
      "normalized_fact": "Default routing load-balances across providers. The provider object supports order and allow_fallbacks; allow_fallbacks defaults to true.",
      "state": "unverified",
      "reviewer_id": null,
      "reviewed_at": null,
      "re_review_at": "2026-08-13T12:00:00.000Z",
      "integrity_hash": "d983aff46c57f618597efd619de0a641936f8bec51779c58e54bec796af1c017",
      "conflicts_with": [],
      "limitations": [
        "No reviewed provider slug and endpoint revision pair proves an immutable MiniMax-hosted route.",
        "The repository candidate route remains variable."
      ],
      "bindings": {
        "dossier_id": "openrouter.minimax-m2.7.normative-extraction.v1",
        "provider_id": "openrouter",
        "openrouter_model_id": "minimax/minimax-m2.7",
        "upstream_provider_id": "minimax",
        "upstream_model_id": null,
        "model_registry_entry_id": "openrouter.minimax-m2.7.variable.v1",
        "route_record_id": "openrouter.minimax-m2.7.variable-route.v1",
        "execution_profile_candidate_id": "openrouter.minimax-m2.7.normative-extraction.candidate",
        "capability_id": "evidence.extraction.normative_claims"
      },
      "attributes": {
        "routing_variable": true,
        "provider_order_supported": true,
        "allow_fallbacks_default": true,
        "exact_endpoint_guaranteed": false,
        "constrained_routing_proposal": {
          "order": ["minimax"],
          "allow_fallbacks": false,
          "require_parameters": true,
          "data_collection": "deny",
          "zdr": true
        },
        "configuration_reviewed": false
      }
    },
    {
      "evidence_id": "openrouter.external.model-release.v1",
      "category": "model_lifecycle_release",
      "claim": "MiniMax documents the MiniMax-M2.7 release on 2026-03-18.",
      "source": {
        "title": "Models",
        "publisher": "MiniMax",
        "canonical_url": "https://platform.minimax.io/docs/release-notes/models",
        "source_type": "official_upstream_documentation",
        "retrieved_at": "2026-07-14T12:00:00.000Z",
        "published_or_effective_at": "2026-03-18T00:00:00.000Z"
      },
      "normalized_fact": "MiniMax's release notes list MiniMax-M2.7 and MiniMax-M2.7-highspeed as released on 2026-03-18.",
      "state": "unverified",
      "reviewer_id": null,
      "reviewed_at": null,
      "re_review_at": "2026-10-12T12:00:00.000Z",
      "integrity_hash": "290e1937091c0c6fefee958641a260872c2b85cfdb180b1b8036ed7ddcbca0e2",
      "conflicts_with": [],
      "limitations": [
        "No immutable weights digest or exact served revision is published for the OpenRouter route."
      ],
      "bindings": {
        "dossier_id": "openrouter.minimax-m2.7.normative-extraction.v1",
        "provider_id": "openrouter",
        "openrouter_model_id": "minimax/minimax-m2.7",
        "upstream_provider_id": "minimax",
        "upstream_model_id": null,
        "model_registry_entry_id": "openrouter.minimax-m2.7.variable.v1",
        "route_record_id": "openrouter.minimax-m2.7.variable-route.v1",
        "execution_profile_candidate_id": "openrouter.minimax-m2.7.normative-extraction.candidate",
        "capability_id": "evidence.extraction.normative_claims"
      },
      "attributes": {
        "release_date": "2026-03-18",
        "exact_upstream_revision_proven": false
      }
    },
    {
      "evidence_id": "openrouter.external.context-window.v1",
      "category": "context_window_limits",
      "claim": "MiniMax documents a 204,800-token context window for MiniMax-M2.7.",
      "source": {
        "title": "Text Generation",
        "publisher": "MiniMax",
        "canonical_url": "https://platform.minimax.io/docs/guides/text-generation",
        "source_type": "official_upstream_documentation",
        "retrieved_at": "2026-07-14T12:00:00.000Z",
        "published_or_effective_at": null
      },
      "normalized_fact": "The upstream model table lists a context window of 204,800 tokens for MiniMax-M2.7.",
      "state": "unverified",
      "reviewer_id": null,
      "reviewed_at": null,
      "re_review_at": "2026-10-12T12:00:00.000Z",
      "integrity_hash": "f9a31f024e0e4e4d864ead300db4fdb2b3f380b1a14a3fb159440ac82b9af4ca",
      "conflicts_with": [],
      "limitations": [
        "An exact maximum output-token limit for every OpenRouter endpoint was not found."
      ],
      "bindings": {
        "dossier_id": "openrouter.minimax-m2.7.normative-extraction.v1",
        "provider_id": "openrouter",
        "openrouter_model_id": "minimax/minimax-m2.7",
        "upstream_provider_id": "minimax",
        "upstream_model_id": null,
        "model_registry_entry_id": "openrouter.minimax-m2.7.variable.v1",
        "route_record_id": "openrouter.minimax-m2.7.variable-route.v1",
        "execution_profile_candidate_id": "openrouter.minimax-m2.7.normative-extraction.candidate",
        "capability_id": "evidence.extraction.normative_claims"
      },
      "attributes": {
        "context_window_tokens": 204800,
        "maximum_output_tokens": null
      }
    },
    {
      "evidence_id": "openrouter.external.modalities.v1",
      "category": "modalities",
      "claim": "Exact input and output modalities for every upstream endpoint are not independently proven.",
      "source": {
        "title": "MiniMax M2.7 - API Pricing & Benchmarks",
        "publisher": "OpenRouter",
        "canonical_url": "https://openrouter.ai/minimax/minimax-m2.7/providers",
        "source_type": "official_openrouter_model_metadata",
        "retrieved_at": "2026-07-14T12:00:00.000Z",
        "published_or_effective_at": null
      },
      "normalized_fact": "The reviewed public metadata does not establish identical modality support across all listed providers.",
      "state": "unverified",
      "reviewer_id": null,
      "reviewed_at": null,
      "re_review_at": "2026-08-13T12:00:00.000Z",
      "integrity_hash": "638e191de649294ddb17997fff75f4934270ca6aad3cbb3fced14e2a915fc397",
      "conflicts_with": [],
      "limitations": [
        "No vision or other non-text modality is accepted for this candidate."
      ],
      "bindings": {
        "dossier_id": "openrouter.minimax-m2.7.normative-extraction.v1",
        "provider_id": "openrouter",
        "openrouter_model_id": "minimax/minimax-m2.7",
        "upstream_provider_id": "minimax",
        "upstream_model_id": null,
        "model_registry_entry_id": "openrouter.minimax-m2.7.variable.v1",
        "route_record_id": "openrouter.minimax-m2.7.variable-route.v1",
        "execution_profile_candidate_id": "openrouter.minimax-m2.7.normative-extraction.candidate",
        "capability_id": "evidence.extraction.normative_claims"
      },